,NPM,Judul,Abstrak,jurusan
35,080411100012,APLIKASI DAN DESAIN MODEL DECISION AID PELANGGANPADA E-COMMERCE TOKO BATIK TULIS MADURA,"Toko Batik Tulis Madura merupakan salah satu toko yang telah beroperasi sejak tahun 2011 denganmenggunakan website e-commerce. Walau telah menggunakan model e-commerce, website tersebut memilikikekurangan yaitu belum ada fitur rekomndasi untuk memudahkan konsumen mencari barang yang ingindibelinya. Penelitian ini bertujuan membuat rekomendasi dengan decision aid untuk membantu pelanggandalam memilih produk di website Toko Batik Tulis Madura. Teknik pengumpulan analis data terdiri dariStudi Literatur yang berhubungan dengan decision aid dan multi criteria, Observasi dilakukan terhadapwebsite Toko Batik Tulis Madura dan Interview dilakukan kepada pemilik website Toko Batik Tulis Madura.Pembuatan implementasi pada Penelitian ini menggunakan model waterfall. Jenis decision aid yang akandiimplementasikan adalah Multi Criteria Filtering. Metode pembobotan yang digunakan pada Multi CriteriaFiltering yaitu Decision Matrix. Hasil ujicoba dengan jumlah sample percobaan sebanyak 50 kali dataperconbaan pencarian, presentase akurasi adalah 94% dan error adalah 6%. Hasil uji kelayakan dari beberapakuisoner dihasilkan bahwa performa yang dimiliki tool ini cukup baik dan tool ini layak untuk diintegrasikanserta digunakan dalam website e-commerce.Kata Kunci: Decision, Aid, Multi, Criteria, Filtering",Teknik Informatika
36,070411100170,Segmentasi Parasit Malaria Dalam Sel Darah Menggunakan Operasi Morfologi Dan Transformasi Watershed,"Malaria disebabkan oleh intraseluler parasit bersel tunggal yang dimiliki genus Plasmodium yang menginfeksi manusia dengan memasuki aliran darah. Dampak malaria secara geografis memiliki tingkat  transmisi tertinggi di daerah tropis dan subtropics, yaitu di negara-negara yang memiliki tingkat pertumbuhan penduduk yang besar (termasuk Indonesia). Pendeteksian parasit malaria dapat dilakukan mencari titik kromatin. Bila tidak ada titik kromatin pada sel darah merah  maka sel darah merah tersebut di anggap sebagai sel darah merah sehat. Pendeteksian titik kromatin secara manual akan memerlukan waktu yang lama. Proses segmentasi diharapkan sebagai langkah pertama untuk memudahkan pendeteksian titik kromatin karena segmentasi merupakan  salah  satu  faktor yang sangat penting dalam analisis suatu gambar. Penelitian ini melakukan segmentasi sel darah merah dengan menggunakan operasi Morfologi, deteksi tepi Canny, dan transformasi Watershed. Data yang digunakan sebanyak 15 data citra dan setiap citra akan diuji dengan empat macam operasi Morfologi kemudian citra hasil Morfologi akan diuji sebanyak 16 kali percobaan dengan parameter masking, sigma, high threshold (HT), dan low threshold (LT) dari deteksi tepi Canny. Hasil pengujian kemudian disegmentasi dengan menggunakan transformasi Watershed. Perhitungan tingkat akurasi dilakukan dengan membandingkan koordinat tiap piksel citra hasil segmentasi dengan citra ground truth  dan menghasilkan nilai rata-rata akurasi sebesar 39.3 %.",Teknik Informatika
37,050411100558,ANALISA DATA ANTARAN POS EXPRESS MENGGUNAKANMETODE RADIAL BASIS FUNCTION NEURAL NETWORK (RBF-NN)STUDY PT. POS INDONESIA SURABAYA,"PT. Pos Indonesia (Persero) merupakan salah satu perusahaan yang bergerak di bidang komunikasi. Saat ini,salah produk pelayanan PT. Pos Indonesia (Persero) adalah produk Pos Express.  Produk  Pos  Express inidiharapkan dapat diminati masyarakat dan dapat tetap bertahan bahkan  semakin menunjukkan keunggulan PT.Pos Indonesia (Persero). Untuk  itu perlu dilakukan  analisis untuk melihat pola perkembangan, kemajuan  yangtelah ditunjukkan, bahkan untuk melihat dan memperoleh informasi, berupa peramalan  dalam waktu ke depanterhadap produk Pos Express yang masuk  ke kantor Mail  Processing Center  (MPC) Surabaya. Dalam  hal  inianalisis yang dilakukan adalah peramalan jumlah produk Pos Express dengan menggunakan Metode RBF-NN(Radial Basic function neural  network).  Hasil  analisa  pada  ujicoba  yang  dilakukan  menghasilkan  nilai  yangcukup optimal, salah satunya pada percobaan 2 inputan dengan hasil peramalan pada epoch ke-60  yangmemperoleh hasil MSE : 0.124497 dan MAPE : 15.058923 dengan hasil ramal yang berjumlah 2587.9966.Kata kunci: Peramalan , Jaringan Syaraf Tiruan (JST), Radial Basis Function neural network (RBF-NN).",Teknik Informatika
38,070411100133,Deteksi Manusia Menggunakan Histogram of Oriented Gradients dan Naïve Bayes Classifier,"Deteksi manusia merupakan  suatu aplikasi yang berfungsi untuk mendeteksi objek manusia dalam sebuah citra. Beberapa keuntungan yang dapat diambil dari kajian ini, yaitu penerapan pada video pengawasan. Namun, dalam video pengawasan manusia yang dideteksi dalam keadaan bergerak. Sedangkan aplikasi ini, hanya mendeteksi atau menemukan objek manusia dari background sebuah citra. Sehingga dalam proses pembuatan aplikasi ini diperlukan perhitungan – perhitungan khusus untuk mendapatkan hasil yang baik. Penelitian ini menggunakan dua tahap yaitu proses ekstraksi fitur dan klasifikasi. Proses ekstraksi fitur menggunakan metode Histogram Of Oriented Gradients (HOG). Pada prinsipnya HOG menggunakan histogram untuk memperoleh ekstraksi fitur tersebut, dengan  beberapa langkah diantarnya yaitu konversi citra, gradient compute dan normalisasi. Sedangkan pada metode Naive Bayes Classifier ini di gunakan untuk proses pengklasifikasian atau pencocokan citra. Sehingga pada hasil akhir dapat diketahui kelas citra yang telah diuji. Berdasarkan uji coba aplikasi menggunakan perhitungan distribusi gaussian probabilitas pada naive bayes classfier dengan nilai threshold = 12,13,14 dan 15 pada skenario 1, 2 dan 3 diperoleh rata – rata akurasi sebesar 68,65%.Kata kunci : Histogram Of Oriented Gradient, Naive Bayes Classifier",Teknik Informatika
39,080411100010,KLASIFIKASI STATUS GIZI BALITA MENGGUNAKAN KOHONEN SELF ORGANIZING MAP,"Aplikasi klasifikasi status gizi balita ini dibuat untuk mempermudah dilakukannya kontrol terhadap perkembangan status gizi balita terutama di tempat penelitian ini dilakukan yaitu Kecamatan Arosbaya, tepatnya di Puskesmas Arosbaya. Aplikasi ini juga dapat digunakan sebagai media informasi karena dapat diisi dengan informasi yang berkaitan dengan Puskesmas Arosbaya sendiri. Untuk menentukan status gizi balita di aplikasi ini, digunakan metode Kohonen Self Organizing Map, dengan mengambil data dari Puskesmas Arosbaya. Parameter yang digunakan ada empat, yaitu: usia, jenis kelamin, tinggi badan, dan berat badan. Karena metode K-SOM hanya dapat digunakan untuk menentukan cluster maka dibuatlah sebuah rule untuk menentukan klasifikasi data pada kelas tertentu.Umumnya untuk mengetahui status gizi balita hanya menggunakan tiga parameter, namun pada penelitian ini akan menggunakan empat parameter. Hasil klasifikasi akan dibagi menjadi 3 kelas, yaitu: kelas 1 (status gizi kurang), kelas 2 (status gizi normal), dan kelas 3 (status gizi normal). Hasil penelitian menunjukkan bahwa sebanyak 88,17% (82 balita) balita berstatus gizi kurang, 8,6% (delapan balita) balita berstatus gizi normal, dan 3,23% (tiga balita) balita berstatus gizi lebih dengan nilai learning rate dan MSE akhir masing-masing 0,09436 dan 0,000792353. Sedangkan nilai akurasi, sencitivity, dan specificity masing adalah 100%.Kata Kunci: Kohonen Self Organizing Map, status gizi balita, Puskesmas Arosbaya",Teknik Informatika
40,070411100083,PERANCANGAN SISTEM INFORMASI PERENCANAAN PRODUKSI DAN PERSEDIAAN BAHAN BAKU TINTA MENGGUNAKAN METODE EOQ (ECONOMIC ORDER QUANTITY)(Studi Kasus Di PT Inktech Indahmulya),"Penelitian ini membahas tentang perancangan sistem informasi perencanaan produksi dan persediaan bahan baku tinta menggunakan metode EOQ (Economic Order Quantity) di PT. Inktech Indahmulya. Selama ini dalam menjalankan rencana produksi yang ada masih menggunakan perencanaan produksi secara sederhana dan didasarkan pengalaman produksi periode-periode sebelumnya, sehingga perusahaan belum mengetahui apakah rencana produksi yang diterapkan sudah optimal. Untuk dapat menentukan jumlah persediaan barang secara tepat, diperlukan pengetahuan untuk mengetahui berapa jumlah barang yang dibutuhkan tiap periode dengan melakukan peramalan. Metode peramalan yang digunakan adalah metode single exponential smoothing dan metode single moving average, metode ini digunakan untuk melakukan peramalan kebutuhan bahan baku pada periode selanjutnya. Hasil penelitian ini mengkonfirmasikan  untuk menentukan jumlah tinta PMG yang harus diproduksi konsisten menggunakan metode peramalan single exponential smoothing dengan nilai MSE berada pada 0,1. Nilai tersebut digunakan untuk menentukan jumlah material produksi yang dibutuhkan dengan menggunakan metode Economic Order Quantity (EOQ). Dari hasil uji coba sistem ini didapatkan hasil biaya persediaan terendah dan jumlah kebutuhan bahan baku yang  diperlukan untuk periode selanjutnya.",Teknik Informatika
41,070411100102,ANALISIS PERAMALAN PENJUALAN PRODUK ASESORIS KOMPUTER MENGGUNAKAN METODE EXPONENTIAL SMOOTHING (ES) DAN ORDINARY LEAST SQUARE (OLS),"Dengan prediksi yang baik, dapat dibuat rencana kerja perusahaan lebih efektif dan efisien. Semakin banyak orang menggunakan Komputer  maka jumlah permintaan konsumen pada Asesoris komputer secara otomatis penjualannya juga akan meningkat. Oleh karena itu dibutuhkan sistem yang dapat memprediksi jumlah penjualan tiap minggunya agar perusahaan mendapatkan keuntungan yang maksimal. Untuk meramalkan pejualan Asesoris komputer Digunakanlah metode peramalan Single Exponential Smoothing (SES) dan metode Oldinary Least Square (OLS). Hasil peramalan tersebut akan dihitung  dan dibandingkan menggunakan Mean Square Error (MSE) untuk mendapatkan hasil error yang terkecil dan peramalan terbaik. Dari beberapa hasil tes perhitungan peramalan yang telah dilakukan dapat diambil kesimpulan bahwa proses peramalan penjualan asesoris komputer menggunakan metode Single Exponential Smoothing (SES) dan Oldinary Least Square (OLS) cukup baik diterapkan untuk studi kasus di SKY DISK Surabaya. Dengan mendapatkan rata-rata MSE sebesar 5257.5 dan rata-rata MAPE sebesar 0.9463%.",Teknik Informatika
42,050411100538,SISTEM INFORMASI GEOGRAFIS PEMETAAN WILAYAH BERDASARKAN TINGKAT KESEJAHTERAAN DI KABUPATEN BANGKALAN MENGGUNAKAN METODE FUZZY MAMDANI,"Menurut pemetaan yang dilakukan oleh Tim Nasional Percepatan Penanggulangan Kemiskinan (TNP2K) pada tahun 2011, kabupaten-kabupaten di pulau Madura memiliki masalah kemiskinan dan merupakan wilayah dengan prioritas 1 dan 2 dalam penanganan kerentanan pangan. Oleh karena itu penulis membuat sistem informasi geografis pemetaan wilayah berdasarkan tingkat kesejahteraan menggunakan metode Fuzzy Mamdani. Metode ini mengatasi keterlibatan objek yang memiliki ketidakpastian di dalam Sistem informasi geografis. Tahapan proses perhitungannya adalah: pembentukan himpunan fuzzy, aturan fungsi implikasi, komposisi aturan dan defuzzyfikasi (nilai z), yang kemudian akan diimplementasikan kedalam pemetaan, sehingga informasi dapat diperolah dengan cepat dan efisien. Dari uji coba yang dilakukan sistem Kec. Tragah dan Kec. Galis, tingkat kesejahteraannya kurang (pemetaan berwarna merah), dengan nilai “Kesejahteraan (Z)” (Z = 0,0). Sedangkan untuk Kec. Kamal (Z = 62,2), Kec. Tanah Merah (Z = 57,1), Kec. Modung (Z = 61,50), Kec. Arosbaya (Z = 61,4), Kec. Sepuluh (Z = 56,7), Kec. Klampis (Z = 65,00), Kec. Konang (Z = 63,7), Kec. Geger (Z = 55,7), Kec. Labang (Z = 56,6), Kec. Blega (Z = 55,9), Kec. Kwanyar (Z = 60,4), Kec. Burneh (Z = 56,10), Kec. Socah (Z = 60,8), Kec. Tanjung Bumi (Z = 57,7)dan Kec. Kokop (Z = 57,4) tingkat kesejahteraannya sedang (pemetaan berwarna kuning), Kec. Bangkalan (Z = 68,5) tingkat kesejahteraanya tinggi (pemetaan berwarna hijau).Kata Kunci: Sistem Informasi Geografis, Fuzzy Mamdani, Tingkat Kesejahteraan",Teknik Informatika
43,080411100011,PENERAPAN METODE RADIAL BASIS FUNCTION NETWORK DENGAN K-MEANS CLUSTER UNTUK PERAMALAN KEBUTUHAN STRAW,"Berawal dari permintaan akan Straw (sperma beku) sapi yang tinggi untuk menghasilkan bibit unggul. Bidang Peternakan Dinas Kelautan, Perikanan dan Peternakan (DKPP) Sampang masih belum dapat menentukan berapa banyaknya Straw yang dibutuhkan pada saat permintaan itu datang. Sering terjadi stok Straw yang tersedia kurang memenuhi permintaan para peternak sapi, atau malah sebaliknya persediaan Straw yang ada masih banyak. Data yang digunakan adalah data penggunaan Straw di Kabupaten Sampang bulan Januari 2008 sampai Desember 2011. Peramalan kebutuhan Straw merupakan proses untuk memperkirakan jumlah kebutuhan Straw di masa datang. Metode peramalan yang digunakan dalam sistem ini adalah metode Radial Basis Function Network (RBFN) dengan penentuan hidden node menggunakan K-Means Cluster. Metode K-Means digunakan karena ketepatan penentuan nilai centroid yang akurat, mudah dan penentuannya awalnya secara random. Sedangkan dalam penentuan nilai error menggunakan MAPE (Mean Absolute Percentage Error) dan MSE (Mean Square Error). Dalam uji coba sistem diketahui bahwa sistem mampu memprediksi kebutuhan Straw satu bulan kedepan. Dari evaluasi kinerja sistem diketahui bahwa nilai MAPE dan MSE terkecil diperoleh pada jumlah cluster=3 yang mempunyai Nilai MAPE 10.12%  dan MSE 0.0081.",Teknik Informatika
44,070411100158,AUTO LEVELING BERBASIS FINITE STATE MACHINE (FSM) PADA GAME PEMBELAJARAN BAHASA INGGRIS,"Pengetahuan tentang bahasa Inggris pada jaman globalisasi saat ini sangatlah penting dan menjadi salah satu sarana untuk berkompetisi di segala bidang. Namun demikian, seringkali proses pembelajaran tidak dapat berjalan dengan lancar dikarenakan kurangnya metode pembelajaran yang kurang interaktif. Berangkat dari permasalahan tersebut maka dibangunlah sebuah game yang berunsur edukasi. Game berunsur edukasi harusnya menyenangkan dan tidak terlalu mudah atau terlalu sulit dimainkan  salah satunya dengan penerapan Artifical Intelegent (kecerdasan buatan). Dalam penelitian ini adalah bagaimana pemain mendapatkan tantangan (soal) sesuai dengan kemampuannya (pelevelan mandiri/auto leveling). Sehingga pemain tidak merasa frustasi (jika soalnya terlalu sulit) atau bosan (jika soalnya terlalu mudah). Metode yang dapat digunakan untuk membuat game yang mempunyai pelevelan mandiri adalah metode Finite State Machine (FSM) dan seluruhnya akan diimplementasikan kedalam game engine XNA. Dalam game pembelajaran bahasa Inggris ini terdapat speaking dan reading yang akan memanfaatkan teknologi speech recognition yang terdapat didalam XNA game studio. Dengan melakukan uji coba sistem kepada responden menghasilkan beberapa hal menjadikan game sebagai salah satu media pembelajaran, terciptanya game yang menarik dan menjadi game yang adaptif dengan penerapan perlevelan mandiri. Penggunaan speech recognition dapat meningkatkan kemampuan berbicara dalam bahasa Inggris. Kata Kunci : Education Game, Automatic Leveling, FSM (Finite State Machine), XNA game engine, Speech Recognition.",Teknik Informatika
45,050411100651,RANCANG BANGUN SISTEM INFORMASI PEMETAAN TANAMAN PERTANIAN DI KABUPATEN BANGKALAN,"Kabupaten Bangkalan memiliki lahan pertanian seluas kurang lebih 98.683,38 Ha atau sekitar 79,03 % dari luas kabupaten Bangkalan seluruhnya. Lahan tersebut terdiri atas sawah teknis seluas 1.956,49 Ha tegal seluas 71.751,98 Ha, lahan kering mencapai 77.999,63 Ha yang tersebar di setiap kecamatan dengan topografi datar hingga berbukit. Namun demikian pembangunan pertanian mengalami hambatan karena selain kesuburan tanah rendah sebagian besar pembangunan pertanian masih tradisional  tanpa memerhatikan aspek kesesuaian lahan dan tanaman. Dalam tugas akhir ini dikembangkan sistem informasi pemetaan tanaman pertanian di kabupaten Bangkalan berbasis lahan. Penentuan jenis tanaman pada sistem berpedoman  pada hasil analisa kriteria kesesuaian jenis lahan dan jenis  tanaman dengan menggunakan metode matching dari Dinas Pertanian dan Peternakan Balai Penyuluhan Pertanian (BPP)  kabupaten Bangkalan. Data yang diperoleh diolah menjadi data spasial atau peta lokasi tanaman dengan memanfaatkan Google Maps sebagai aplikasi pemetaannya. Aplikasi Google Maps dipilih karena lebih memudahkan dalam mengetahui dan menentukan lokasi secara lebih detail. Penerapan aplikasi sistem informasi ini dapat membantu  pengguna khususnya petani dalam perencanaan dan pemilihan jenis tanaman yang sesuai untuk dikembangkan pada setiap kecamatan sehingga dapat meningkatkan produktivitas, kuantitas dan kualitas pertanian di kabupaten Bangkalan. 	Kata kunci: 	Kabupaten Bangkalan, Sistem Informasi, Google Maps, Lahan dan Tanaman.",Teknik Informatika
46,070411100119,Pengenalan Tulisan Tangan Carakan Jawa Secara Real Time  Dengan Menggunakan Dominant Point,"Pengenalan tulisan tangan adalah salah satu cabang dari pengenalan pola. Carakan merupakan tulisan yang cukup kompleks dan memiliki karakteristik yang lebih unik dibandingkan dengan tulisan latin, apalagi bila ditulis dengan tulisan tangan. Faktor yang menyebabkan proses pengenalan tulisan carakan sulit untuk dilakukan adalah variasi bentuk tulisan carakan dan memiliki kemiripan antar huruf. Hal ini memungkinkan adanya kesalahan dalam proses klasifikasi. Pada penelitian ini dibangun sistem pengenalan tulisan tangan secara real time dimana proses ekstraksi ciri menggunakan metode Dominant Point untuk mendapatkan ciri pada setiap karakter masukan. Metode ini pada dasarnya sistem akan membaca arah goresan pena yang didasarkan pada kumpulan titik. Pada proses klasifikasi serta pengenalan karakter menggunakan Fine Classification. Pada proses ini, pengenalan dilakukan dengan tiga tahap yaitu penilaian prakandidat, menyeleksi kandidat, lalu pencocokan karakter. Proses ini yang membuat sistem dengan cepat melakukan proses pengenalan. Dari uji coba yang dilakukan pada sistem, hasil terbaik untuk pengenalan citra huruf tulisan tangan carakan diperoleh dari data pelatihan sebanyak 600 citra pada data uji coba skenario ke 3 dengan akurasi sebesar 90%. Sedangkan hasil terendah diperoleh dari data pelatihan sebanyak 200 citra pada data uji coba skenario ke 1 dengan akurasi sebesar 40%. Hasil akurasi rata-rata dari sembilan skenario adalah sebesar 67,67%.Kata kunci: Handwriting Recognition, Carakan, Dominant Point,  Fine Classification.",Teknik Informatika
47,080411100113,SISTEM PEROLEHAN CITRA BERBASIS ISI MENGGUNAKAN WAVELET HAAR DAN EUCLIDEAN DISTANCE,"Batik merupakan seni yang paling penting dalam kehidupan masyarakat Indonesia. Keanekaragaman batik berasal dari beberapa wilayah diseluruh indonesia sehingga menyimbolkan karakteristik ciri pola batik yang berbeda-beda dari masing-masing daerah tempat batik tumbuh dan berkembang. Tugas Akhir ini telah berhasil membuat suatu Sistem Perolehan Citra berbasis Isi (SPCI) dengan ciri tekstur yang bertujuan untuk mengetahui ciri dari pola batik tersebut. SPCI merupakan metode atau teknik pencarian gambar citra yang mirip (similar) dengan melakukan perbandingan antara citra query dengan citra yang ada dalam basis data. Pada Penelitian  ini menggunakan ciri tekstur sebagai proses pencarian kemiripan dari delapan wilayah citra batik yang  berbeda yaitu: Cirebon, Bali, Bangkalan, Pamekasan, Sumenep, Yogyakarta, Solo, dan Pekalongan sebagai obyek perolehan citra berbasis isi. Metode yang digunakan pada penelitian ini berbasis tekstur kasar atau lembut yaitu metode Wavelet Haar. Wavelet Haar merupakan metode dimana pada setiap citra didekomposisi menjadi 4 bagian yaitu LL, LH, HL, dan HH. Pada masing-masing bagian tersebut ditentukan nilainya. Sehingga dari hasil ekstraksi fitur akan dilakukan pengukuran kemiripan dengan citra basis data dengan menggunakan metode Euclidean Distance. Citra query dan citra basis data yang dipergunakan sebanyak 200 citra dengan delapan kelas citra didalamnya. Citra tertinggi dari hasil uji coba skenario-skenario pada penelitian ini dapat diambil kesimpulan bahwa akurasi tertinggi ada pada kelas bangkalan, cirebon, pamekasan dan solo. Jumlah citra yang dihasilkan dari perhitungan akurasi adalah 8 citra yang mirip dari 10 citra terbaik yang ditampilkan berdasarkan fitur citra Roughness, yaitu fitur untuk mengetahui apakah sebuah tekstur tersebut kasar atau lembut. Dengan hasil nilai akurasi tertinggi sebesar 80 %.",Teknik Informatika
48,070411100136,SISTEM PERAMALAN KEBUTUHAN OBAT MENGGUNAKAN METODE JARINGAN SYARAF TIRUAN ALGORITMA  BACKPROPAGATION DENGAN FUNGSI LYAPUNOV,"Obat merupakan salah satu kebutuhan penting dalam rumah sakit. Selama ini, kebutuhan pengumpulan data obat adalah masalah yang sering dihadapi oleh Farmasi yang memiliki kewenangan dalam pengadaan obat-obatan di rumah sakit Dr H. Slamet Martodirdjo Pamekasan. Dalam rangka menjamin ketersediaan obat perlu untuk mengatasi kebutuhan obat sesuai dengan jumlah yang dibutuhkan. Dalam rangka memenuhi tingkat kebutuhan untuk obat perlu untuk meramalkan masa depan pasokan obat dengan menggunakan data sebelumnya sebagai data untuk menentukan nilai kesalahan pelatihan metode yang digunakan. Dalam penelitian ini, metode yang akan digunakan untuk memprediksi kebutuhan obat adalah Jaringan Syaraf menggunakan algoritma Backpropagation dengan penambahan fungsi Lyapunov. Dengan penambahan fungsi ini, mampu memecahkan masalah yang terjadi dalam Backpropagation standar sering lambat untuk mencapai konvergensi.Dari uji coba yang dilakukan dengan 3 Skenario didapatkan hasil parameter terbaik untuk melakukan peramalan pada nama obat Ambroxol dengan  nilai (?) sebesar 13, learning rate 0.4 dan epoch=125 memperoleh  nilai MAPE  2.7% .  Obat Bisoprolol Tab 5mg dengan nilai (?) sebesar 2,  learning rater  0.5 dan epoch 150 memperoleh nilai MAPE  2,94089%.  Obat Cefixime Caps 100mg dengan  nilai (?) sebesar 4, learning rate   0.2  dan epoch 100  memperoleh nilai MAPE  1,10466%.",Teknik Informatika
49,070411100023,Visualisasi Proses Terjadinya Hujan Berbasis Second Life,"ABSTRAKPerkembangan teknologi masa kini telah memungkinkan manusia untuk merasakan suatu pengalaman yang nyata tanpa perlu adanya dunia luar atau materi. Teknologi ini sering disebut teknologi virtual reality. Teknologi virtual reality dapat diterapkan di berbagai bidang salah satunya adalah didalam dunia pembelajaran. Didalam penelitian ini akan membuat suatu pembelajaran mengenai proses terjadinya hujan yang dikemas didalam simulasi virtual reality. Tujuan utama dari pengembangan virtual reality adalah untuk menirukan alam nyata ke dalam dunia maya semakin membuat kedekatan imitasi animasi realitas ke dalam dunia maya. Kehadiran teknologi virtual reality ini dimanfaatkan semaksimal mungkin dalam kehidupan sehari-hari. Didalam Penelitian ini ditetapkan perilaku yang menjadi objek adalah kegiatan proses terjadinya hujan. Kegunaan Second Life sebagai platform untuk menghidupkan konsep dalam pembelajaran proses terjadinya hujan menjadi 3 dimensi karena Second Life sangat memadai untuk memvisualisasikan sebuah bentuk 3D dan Second Life merupakan Platform yang sangat mendukung untuk membuat suatu pembelajaran. Hasil uji coba visualisasi terhadap responden mendapatkan suatu pembelajaran visualisasi proses hujan dengan cara yang berbeda dan menarik dan mudah dimengerti. Kata kunci: Virtual Reality (VR), Multimedia Proses Hujan, Second Life ",Teknik Informatika
50,080411100078,IMPLEMENTASI  METODE N-GRAM PADA PEMBUATAN GAME FIGHTING MADURA BERBASIS ANDROID OS MOBILE,Teknologi mobile  game  berkembang  dengan  sangat  pesat. mobile  game memiliki  banyak  peminat  dari berbagai kalangan karena keragaman variasinya. Hal inilah yang menjadi dasar bagi para pengembang untuk terus  mengembangkan mobile  game. Pada  penelitian  ini  dibuat sebuah Game  Fighting dengan  platform Android. Game  Fighting adalah  salah  satu  genre  video  game  dimana  seorang  player  mengontrol  seorang karakter di layar permainan dan  melakukan pertarungan jarak dekat (close combat) dengan  seorang lawan. Game  fighting  dibuat  dengan  mengimplementasikan  Metode  N-gram.  Metode  N-gram  diterapkan  pada pembuatan  pergerakan  NPC  (Non  Playable  Character)  dalam  bertarung. NPC  dapat  memprediksi  gerakan lawan  selanjutnya  dengan  menggunakan  metode  N-gram.  Dari  30  gerakan  pertama  player  NPC  dapat memprediksi 9 gerakan dengan tepat. Prediksi akan menjadi semakin akurat dengan semakin banyaknya key yang tercipta. 6 dari 9 prediksi gerakan yang tepat terjadi antara pada gerakan ke-20 sampai gerakan ke-30. Metode ini akan cenderung membuat NPC bertahan jika player bergerak agresif menyerang. Hasil pengujian Game  Fighting  dapat  berjalan  dengan  baik  pada  emulator  dan  smartphone  android  yang  memiliki  resolusi screen 320 x 480 pixels. Aplikasi game ini masih dapat berjalan lancar pada tipe smartphone Android yang memiliki  resolusi  screen  lebih  besar  atau  lebih  kecil  dari 320  x  480  pixels  akan  tetapi  tampilannya  tidak sempurna. ,Teknik Informatika
