,NPM,Judul,Abstrak,jurusan
18,070411100114,SISTEM PEROLEHAN CITRA BERBASIS ISI MENGGUNAKANGRAY LEVEL DIFFERENCE METHOD BERDASARKANCIRI TEKSTUR PADA POLA BATIK,"Batik adalah kerajinan yang memiliki nilai seni tinggi dan telah menjadi bagian dari budaya Indonesia sejak lama. Batik di Indonesia mempunyai beragam jenis tekstur batik, warna batik, dan pola batik yang mencerminkan asal usul daerah dari batik tersebut. Saat ini pencarian citra berbasis teks sudah tidak efektif lagi karena adanya penilaian subjektif dari pengguna dalam merepresentasikan suatu citra. Karena itu diperlukan suatu sistem yang dapat menangani pencarian citra menggunakan query berupa citra atau disebut Sistem Perolehan Citra berbasis Isi (SPCI) atau Content Based Image Retrieval (CBIR). Penelitian  ini menggunakan ciri tekstur sebagai proses pencarian kemiripan dari delapan kelas citra batik yang  berbeda yaitu: Cirebon, Bali, Bangkalan, Pamekasan, Sumenep, Yogyakarta, Solo, dan Pekalongan sebagai objek perolehan citra berbasis isi. Sistem dibangun dengan proses utamanya yaitu ekstraksi fitur tekstur dengan menggunakan metode Gray Level Difference Method (GLDM) menggunakan empat arah utama. GLDM menghitung perbedaan mutlak antara sepasang derajat keabuan yang terpisah oleh jarak dan arah tertentu. Hasil ekstraksi fitur dilakukan pengukuran jarak kemiripan menggunakan metode Euclidean Distance. Dari uji coba aplikasi menggunakan pengukuran kemiripan Euclidean Distance dengan nilai threshold=7 diperoleh akurasi presisi sebesar  61%  pada data pelatihan 168 dan data uji coba 32 dengan 10 citra yang ditampilkan. ",Teknik Informatika
19,070411100036,ONTOLOGY SEMANTIC WEB UNTUK PENCARIAN TUGAS AKHIR PADA SISTEM INFORMASI TUGAS AKHIR(SIMTAK),"Kebutuhan pencarian data pada internet yang cepat dan tepat saat ini menjadi faktor penting para pengguna layanan internet. Sistem Informasi Tugas Akhir (SIMTAK) yang digunakan di Fakultas Teknik Universitas Trunojoyo Madura juga membutuhkan pencarian data yang tepat dan cepat berdasarkan konteks. Sistem pencarian yang dipakai saat ini adalah pencarian database dimana masih belum mampu memberikan hasil pencarian yang sesuai dengan konteks atau keywords yang diinputkan. Untuk memiliki kebenaran dalam sistem kecerdasan, pengetahuan perlu ditangkap, diproses, digunakan kembali, dan disampaikan. Ontologi mendukung semua tugas ini. Ontologi adalah spesifikasi dari konseptualisasi. Semantik web adalah sebuah abstrak representasi pada World Wide Web (WWW) yang berbasiskan pada sebuah standar yang didefinisikan menggunakan Resource Description Framework (RDF) dan Ontology Web Language (OWL) ide dasarnya adalah untuk membawa web memiliki definisi dan link data sehingga dapat digunakan lebih efektif untuk mencari, otomasi, integrasi dan reuse informasi pada berbagai aplikasi. Semantik web didefinisikan sebagai sekumpulan teknologi, dimana memungkinkan komputer memahami arti dari sebuah informasi berdasarkan metadata, yaitu informasi mengenai isi informasi seperti judul, pengarang, modifikasi tanggal pada halaman web, dan hak cipta pada halaman web. Dengan menggunakan semantik web, pencarian tugas akhir ini mampu memberikan hasil berdasarkan persamaan makna kata pada keyword yang diinputkan oleh user.Kata Kunci : Mesin pencari, Semantic web, Tugas akhir.ABSTRACT",Teknik Informatika
20,070411100029,RANCANG BANGUN APLIKASI INTRUSION PREVENTION SYSTEM PADA JARINGAN BERBASIS PROTOKOL TCP/IP MENGGUNAKAN SNORT DAN IPTABLES,"Dalam setiap perusahaan tentunya memiliki data penting berkaitan dengan kegiatan bisnis mereka yang perlu dijaga dan diamankan dari orang yang tidak berhak mengaksesnya. Seringkali  muncul aksi ilegal yang mencoba merusak server bahkan sampai mencuri data perusahaan bisa mengakibatkan kesalahan fatal terhadap kelancaran kegiatan bisnis perusahaan disebabkan data yang tidak valid lagi. Menyikapi masalah tersebut, maka diperlukannya sistem monitoring keamanan yang mampu mengamankan server dari tindakan penyusupan. Intrusion Prevention System (IPS) merupakan solusi yang mampu memberikan keamanan pada jaringan server dari tindakan penyusupan. IPS ini mengembangkan Snort sebagai fungsi pendeteksi yang dikombinasikan dengan IPTables Firewall sebagai pencegah adanya penyusupan. IPS ini juga dilengkapi dengan user interface BASE (Basic Analysis and Security Engine)  dan manajemen rule sehingga memudahkan admin untuk memonitor sistem keamanan dari tindakan penyusupan ke jaringan server. Snort akan membuat alert ketika terdeteksi adanya serangan yang disimpan dalam log Snort dan memerintahkan IPTables untuk melakukan drop terhadap alamat penyerang. Kemudian detail serangan bisa dilihat pada tampilan user interface BASE. Dari hasil pengujian, didapatkan bahwa Snort dan IPTables telah bekerja dengan baik menjadi IPS yang mampu memberikan respon secara cepat ketika terdeteksi adanya serangan. Waktu tanggap rata-rata kurang dari 5 detik, dari awal serangan sampai terdeteksinya alert.",Teknik Informatika
21,060411100824,APLIKASI CITRA MOSAIK PANORAMIK MENGGUNAKAN METODE WATERSHED,"Citra digital banyak dimanfaatkan dalam berbagai aspek kehidupan,oleh karena itu membutuhkan tampilan citra yang yang dapat merepresentasikan objek yang terdapat dalam citra tersebut. Salah satu permasalahan yang ada saat melakukan pengambilan gambar (citra) adalah kemampuan untuk mengambil gambar yang sangat luas sehingga gambar harus diambil beberapa kali yang menyebabkan gambar atau objeknya menjadi terpisah-pisah. Untuk mengatasi permasalahan ini diperlukan proses penggabungan citra. Dan dalam penelitian ini akan digunakan metode Watershed. Dalam metode ini terlebih dahulu ditentukan titik korespondensi pada masing-masing citra kandidat, kemudian daerah hasil korespondensi tersebut akan disegmen menggunkan metode Watershed dan hasil segmentasinya digunakan untuk mencari Region cut sebagai acuan penggabungan citra. Proses penggabungan citra ini dsebut dengan mosaic panoramik. Hasil dari penelitian ini menunjukkan citra panorama yang ideal dapat dperoleh dengan menggunakan citra masukan yang mempunyai kesamaan obyek dan titik korespondensi dipilih pada obyek yang sama diantara dua citra masukan tersebut.Kata kunci :Citra Panorama, MosaikPanoramik, Metode watershed",Teknik Informatika
22,060411100772,ANALISA VALIDITAS PENERIMA BEASISWA MENGGUNAKAN METODE ANALYTIC NETWORK PROCESS DAN TOPSIS,"Beasiswa adalah pemberian berupa bantuan keuangan yang diberikan kepada perorangan yang bertujuan untuk digunakan demi keberlangsungan pendidikan yang ditempuh. Program beasiswa diadakan untuk meringankan beban mahasiswa dalam menempuh masa studi kuliah khususnya dalam masalah biaya. Fakultas Teknik Universitas Trunojoyo memiliki program beasiswa yang harus diberikan kepada yang berhak menerima. Diantaranya Beasiswa Bantuan Belajar Mahasiswa (BBM), Beasiwa Peningkatan Prestasi Akademik (PPA) dan setiap jenis beasiswa memiliki kriteria atau faktor bobot yang berbeda. Tetapi dalam melakukan seleksi beasiswa tentu akan mengalami kesulitan karena banyaknya pemohon, banyaknya kriteria dan masih menggunakan cara manual yang mengakibatkan kurang efektifnya keputusan. Untuk membantu dalam menetapkan seseorang yang layak menerima beasiswa maka dibutuhkan sistem pendukung keputusan. Metode yang digunakan dalam penelitian ini adalah Analytic Network Process (ANP) dan Technique Order Preference by Similarity To Ideal Solution (TOPSIS). Pada penelitian ini akan diangkat suatu kasus yaitu menganalisa validitas alternatif terbaik penerima beasiswa berdasarkan kriteria-kriteria yang telah ditentukan dengan menggunakan metode ANP kemudian dicari solusi pengurutan dengan menggunakan metode TOPSIS. Berdasarkan hasil uji coba sistem, terdapat perbedaan selisih hasil rekomendasi dari sistem terhadap data aktual pemenang beasiswa PPA jurusan informatika, yaitu 78,57%. Sedangkan selisih hasil rekomendasi dari sistem terhadap data aktual pemenang beasiswa BBM jurusan informatika, yaitu 80,95%.Kata kunci: ANP, TOPSIS, MCDM, pengambilan keputusan multi kriteria, seleksi beasiswa.",Teknik Informatika
23,080411100001,SISTEM PERAMALAN PENJUALAN JANGKA PENDEK SPARE PART SEPEDA MOTOR MENGGUNAKAN NEURAL NETWORK(Studi Kasus : Suzuki Kemayoran Bangkalan),"Spare part merupakan salah satu bagian penting dalam pengoperasian mesin pada sepeda motor. Peningkatan jumlah penjualan spare part yang tidak terduga saat proses tune-up menyebabkan kesulitan dalam pelayanan yang terbaik kepada konsumen. Demikian juga sebaliknya, apabila terjadi penurunan jumlah penjualan spare part, maka akan menyebabkan penumpukan spare part di gudang. Oleh karena itu diperlukan sistem peramalan yang mampu meramalkan penjualan spare part pada periode berikutnya. Sistem peramalan ini menggunakan metode Jaringan Syaraf Tiruan algoritma Propagasi Balik dengan momentum untuk meramalkan jumlah penjualan spare part  pada bulan berikutnya. Data yang telah tersimpan dihitung menggunakan epoh dan learning rate yang berbeda. Dari hasil uji coba system, maka dapat disimpulkan bahwa  dengan menggunakan semua data sebagai data training dan menggunakan learning rate 3.5 dan dengan epoh 200 akan menghasilkan tingkat kesalahan 0.0622716.",Teknik Informatika
24,060411100801,PENGEMBANGAN MESIN PENCARIAN ANTIPLAGIASI PADA SIM JURNAL MAHASISWA MENGGUNAKAN ALGORITMA WINNOWING FUZZY K-MEANS,"ABSTRAKPenjiplakan merupakan masalah yang sering muncul dan semakin berkembang terutama dalam bidang pendidikan. Banyak karya tulis yang sebagian bahkan seluruh isinya dibuat dengan menjiplak dari karya tulis orang lain. Untuk mengatasi masalah tersebut, salah satunya solusinya adalah dengan dibuatnya aplikasi yang dapat mengelompokan dokumen dan mendeteksi penjiplakan pada dokumen tersebut. Pada tugas akhir ini dibuat aplikasi yang dapat mendeteksi penjiplakan antar dokumen yaitu dengan membandingkan antar dokumen. Dalam melakukan pendeteksian penjiplakan dokumen digunakan algoritma Winnowing. Algoritma winnowing ini berfungsi untuk melakukan proses dokumen fingerprint, yaitu dengan merubah teks menjadi sekumpulan nilai - nilai hash. Nilai hash ini yang akan digunakan untuk mendeteksi tingkat kesamaan antar dokumen. Dalam hal pengelompokan dokumen dipergunakan algoritma fuzzy k-means. Dari hasil uji coba aplikasi ini dapat diambil kesimpulan bahwa semakin besar nilai n-gram, basis, dan window maka semakin kecil hasil prosentase kemiripan antar dokumen yaitu dengan menghasilkan sebesar 4.17%, dan sebaliknya semakin kecil nilai n-gram, basis, dan window maka semakin besar  prosentase kemiripan antar dokumen yaitu dengan menghasilkan prosentase 98.49%. Pada perhitungan nilai f-measure dipengaruhi oleh keakuratan data yang diproses.Kata Kunci : deteksi penjiplakan, cluster, f-measure",Teknik Informatika
25,080411100086,SISTEM PENDUKUNG KEPUTUSAN PEMILIHAN KARYAWAN BERPRESTASI DENGAN INTEGRASI FAHP dan ELECTRE II,Sumber daya manusia mutlak dibutuhkan untuk kemajuan suatu perusahaan guna menjadikan perusahaan itu menjadi perusahaan yang maju dan tidak kalah bersaing dengan perusahaan lainnya. Dalam hal ini maka dibuatlah Sistem Pendukung keputusan (SPK) pemilihan karyawan berprestasi untuk mencari karyawan berprestasi. Sistem Pendukung keputusan (SPK) ini menggunakan FAHP dan ELECTRE II. Metode FAHP merupakan metode yang cukup obyektif untuk proses penilaian berdasarkan hirarki kriteria yang digabungkan dengan konsep fuzzy sesuai kriteria penilaian kinerja karyawan perusahaan. Setelah mendapat bobot dilakukan proses selanjutnya dengan menggunakan metode ELECTRE II hingga mendapat karyawan berprestasi. Untuk menjaga bahwa penilaian ini tidak berpihak kepada salah satu karyawan dan bebas intervensi dari karyawan maka perusahaan menggunakan pihak luar yang independen dan profesional untuk melakukan penilaian terhadap karyawan. Hasil penilaian dari pihak luar yang berupa angka-angka kemudian oleh departemen sdm dilakukan penjumlahan nilai komulatif kriteria untuk mendapat karyawan terbaik tanpa ada prioritas kriteria yang lebih penting. Dengan menggunakan metode FAHP dan ELECTREII hasil keluaran mendekati keakuratan dengan hasil yang diperoleh dari areal manager di banding dengan hitung manual perusahaan tanpa memperhatikan bobot kepentingan.,Teknik Informatika
26,080411100052,PENGELOMPOKAN KUALITAS KELAS PADA SISWA MENGGUNAKAN INDEKS DAVIES-BOULDIN SOM (SELF ORGANIZING MAP),"ABSTRAKData yang terdapat pada SMA Wachid Hasyim 2 Taman-Sepanjang merupakan data siswa yang masih mentah sehingga data tersebut perlu diolah. Pengolahan data dengan mengelompokan (Clustering) data-data tersebut memiliki beragam metode salah satunya adalah SOM (Self Organizing Map). Untuk menvalidasi data setelah Penggunaan distance matrix digunakan IDB (Indeks Davies-Bouldin). IDB dalam SOM bertujuan untuk meningkatkan akurasi validasi hasil analisa data. Pada akhirnya penganalisaan data dengan studi kasus SMA Wachid Hasyim 2 Taman-Sepanjang ini bertujuan untuk mengetahui tingkat kemiripan siswa dalam satu kelompok (per kelas). Metode SOM mampu mengelompokan data yang berdekatan untuk dicari kemiripannya berdasarkan pola. Kemiripan data pada pengelompokan siswa yang dijadikan tiga cluster dengan learning rate 0.6 serta epoch 10, 20, 30  dengan MSE terkecil = 41.42 di epoch 30 pada 245 data training. Sedangkan yang dijadikan tiga sampai dengan sembilan Cluster dengan learning rate 0.6 serta epoch 10, 20, 30 dengan MSE terkecil = 25.04 di epoch 20 pada cluster  ke-4 dengan  245 data training. Nilai terkecil pada pemvalidasian Cluster dengan IDB menggunakan tiga sampai dengan sembilan Cluster pada 245 data training berada pada  cluster ke-9 dengan nilai IDB = 37.44  dan hasilnya  kurang akurat karena kelas yang terbentuk hanya dua kelompok.Kata kunci:  Clustering, SOM, Eucledian Distance, IDB, SMA Wachid Hasyim 2 Taman-Sepanjang",Teknik Informatika
27,060411100818,APLIKASI CITRA MOSAIC PANORAMIC MENGGUNAKAN METODE SIFT (SCALE INVARIANT FEATURE TRANSFORM),"Sebuah citra banyak diterapkan dalam berbagai aspek kehidupan, misalnya dalam bidang kedokteran untuk mengetahui bagian dalam tubuh manusia atau mendeteksi penyakit, dalam bidang geologi untuk memetakan suatu wilayah tertentu, dan lain sebagainya. Oleh karena itu dibutuhkan suatu tampilan citra yang dapat merepresentasikan suatu obyek. Namun batasan luas citra sering menjadi kendala dalam penerapan fungsi maupun manfaat citra itu sendiri. Untuk itu diperlukan aplikasi penggabungan citra atau mosaic panoramic yang dapat memperluas tampilan citra, sehingga dapat lebih bermanfaat untuk memberikan informasi suatu obyek tertentu. Pada penelitian ini menggunakan metode Scale Invariant Feature Transform (SIFT) untuk pendeteksian keypoint. Jumlah keypoint dapat berubah berdasarkan nilai threshold yang ditentukan. Dari 20 pasang citra yang diteliti, nilai threshold 0.1 pada 12 citra masukan jumlah keypoint yang berkesesuaian bernilai 0, sehingga tidak dapat dilakukan proses mosaic panoramic. Pada nilai threshold 0.6 jumlah keypoint yang berkesesuaian bernilai sedang dan dapat menghasilkan citra hasil mosaic panoramic. Sedangkan pada nilai threshold 0.9 jumlah keypoint yang berkesesuaian pada 14 pasang citra masukan atau 70% dari jumlah citra masukan semakin banyak ditemukan, sehingga  dapat dilakukan proses mosaic panoramic dan menghasilkan citra hasil mosaic panoramic yang lebih baik.Kata Kunci:  Mosaic Panoramic, SIFT (Scale Invariant Feature Transform), Keypoint",Teknik Informatika
28,080411100125,PENGENALAN TELAPAK TANGAN MENGGUNAKAN METODE NAÏVE BAYES BERBASIS REDUKSI DIMENSI  PRINCIPAL COMPONENT ANALYSIS (PCA),"Teknologi biometrik saat ini mengalami perkembangan sangat pesat dan sudah lazim diterapkan pada berbagai bidang aplikasi. Proses pengenalan telapak tangan telah diteliti selama lebih dari 10 tahun.  Telapak tangan merupakan biometrika yang masih relatif baru. Telapak tangan memiliki beberapa karakteristik yang unik berupa garis telapak tangan dan bersifat stabil. Setiap orang mempunyai garis telapak tangan yang berbeda meskipun orang itu kembar. Keunikan dan kestabilan dari garis telapak tangan pada telapak tangan merupakan fitur handal setiap telapak tangan untuk digunakan pada sistem pengenalan. Dalam penelitian ini, proses pengenalan telapak tangan menggunakan metode Naive Bayes sebagai proses classifier dan  reduksi dimensinya menggunakan Principal Component Analysis (PCA). Sistem diuji coba menggunakan 100 citra telapak tangan dari 10 orang, setiap orang terdiri dari 10 sampel telapak tangan. Hasil pengujian rata-rata memperoleh persentase keberhasilan sebesar 51,45%.",Teknik Informatika
29,080411100029,Implementasi Sistem Pakar Pada Pengambilan Keputusan Penentuan Tindakan Medis di Poli Mata Berbasis Web,"Diagnosa penyakit mata dengan sistem informasi yang baik merupakan inti permasalahan pada penelitian ini. Diketahui pada studi kasus ini, dokter sebagai seorang pakar memiliki keterbatasan waktu dalam melayani pasien selama 24 jam, bahkan pada hari-hari selanjutnya. Dokter hanya bekerja tiga hari dalam satu minggu, dan 6 jam pada tiap kali melakukan pelayanan. Adanya asisten dokter juga belum dapat membantu pelayanan ini bekerja denga maksimal. Hal ini lah yang menjadi kurang maksimalnya peranan dokter bagi pasien. Terbatasnya keberadaaan dokter sebagai pakar dan minimnya waktu pelayanan dari dokter pada pasien nya serta minimnya pengetahuan seseorang terhadap gejala atas sakit yang dirasakan, sangat mendukung terdapatnya sistem yang mampu memberikan diagnosa dan solusi mengenai gejala yang diketahui. Berdasarkan hal tersebut, penelitian ini bertujuan untuk membuat aplikasi sistem pakar  berbasis web, yang  dapat mendiagnosa gejala penyakit pada mata. Metode yang digunakan dalam pengembangan aplikasi adalah Fuzzy Mamdani dengan Inferensi Forward Chainning. Input yang dibutuhkan pada sistem ini adalah data jenis gejala dan gejala umum yang diketahui, sedangkan output adalah nilai tingkat keparahan penyakit yang nantinya mengarah pada solusi dari tiap kasus. Dari hasil uji coba sistem yang dilakukan oleh dokter diperoleh nilai keakuratan sebesar 80% dari 10 kasus yang dilakukan. Kata kunci : Metode Fuzzy Mamdani, forward chaining , diagnosa penyakit mata.",Teknik Informatika
30,060411100755,RANCANG BANGUN MANAJEMEN PEMBELAJARAN DAN TES TOEFL BERBASIS MOBILE,"Penggunaan teknologi mobile saat ini sangat marak, disamping keunggulannya dapat mudah bawa dibawa kemana-mana, teknologi mobile sekarang sangat mudah untuk dieksplorasi, terbukti dengan adanya smartphone yang mempunyai banyak layanan yang dapat bermanfaat bagi para penggunanya. Toefl (Test Of English As A Foreign Languange) sangat dibutuhkan dalam menghadapi kemajuan teknologi saat ini, Kurang besarnya minat masyarakat dalam belajar bahasa inggris dan mengikuti tes-tes Toefl yang ada, berpengaruh pada kemajuan teknologi.  Android  merupakan  subset  perangkat  lunak  untuk perangkat  mobile  yang  meliputi  sistem  operasi, middleware,  dan  aplikasi  inti  yang  di  release  oleh Google. Android SDK adalah  tools  API (Application Programming Interface)  yang digunakan untuk memulai membuat aplikasi pada platform Android dengan menggunakan bahasa pemrograman Java. Eclipse adalah sebuah IDE (Integrated Development Environment) yang digunakan dalam  coding  aplikasi Android nantinya. Salah satu pemanfaatan teknologi mobile yaitu dengan membuat media pembelajaran dan tes TOEFL baik soal berupa teks dan audio dengan menggunakan  teknologi Android, tentunya berbasis mobile. Dengan tes TOEFL, pembelajaran test dan kelebihan listening menu di dalam aplikasi ini, diharapkan akan dapat membatu meningkatkan pemahaman pengguna mengenai tes TOEFL.Kata Kunci: tes TOEFL, ANDROID, Java , Mobile, SDK",Teknik Informatika
31,080411100102,Aplikasi Penilaian Kinerja dengan Metodologi Customer Realtionship Management (CRM),"Setiap perusahaan mengharapkan adanya hubungan baik dengan pelanggan, begitupun dengan PT. X sebagai perusahaan yang bergerak di bidang minyak dan gas bumi Negara. Pengelolaan hubungan yang baik akan berdampak pada peningkatan citra perusahaan dimata pelanggan. Penilaian kinerja perusahaan dapat diukur dengan menggunakan kriteria dari CRM Scorecard. CRM Scorecard diambil dari Balanced Scorecard (BSC) dengan berfokus pada pelanggan. Adanya penilaian kinerja dengan metode Analytic Network Process (ANP) untuk pembobotan, PT. X dapat  menilai kinerja perusahaan dengan ditunjukkan oleh Traffic Light System sebagai hasilnya. Hasil scoring KPI menunjukkan bahwa terdapat 2 KPI yang berada pada level buruk, yaitu Ekuitas Pelanggan dan Sistem Penghargaan. Kedua KPI ini diperlukan perhatian yang lebih. Indikator yang berada pada level cukup ada 3 KPI, yaitu yaitu Perluasan Pelanggan, Teknologi Informasi, dan Struktur Organisasi. Perusahaan harus berhati-hati dengan berbagai macam kemungkinan yang dapat terjadi. Indikator yang berada pada level baik ada 9 KPI, yaitu Profitabilitas, Kesetiaan Pelanggan, Kepuasan Pelanggan, Nilai Hubungan dengan Pelanggan, Perolehan Pelanggan, Mempertahankan Pelanggan, Peranan Manajemen, Pelatihan, dan Kerjasama.Kata Kunci:  Sistem Penilaian Kinerja, CRM Scorecard,  Analytic Network Process (ANP), Key     Performance Indicator (KPI)",Teknik Informatika
32,050411100662,Kalibrasi Kamera dengan Menggunakan Metode Tsai,"Teknik kalibrasi sangat berpengaruh terhadap perkembangan computer vision karena setiap proses dalam teknik kalibrasi sangat diperlukan untuk pengolahan lanjutan berbagai macam proses vision. Dengan dilakukannya kalibrasi, proses vision akan menjadi lebih mudah. Dalam prosesnya teknik kalibrasi dilakukan untuk menentukan parameter yang dapat dilakukan untuk proses vision selanjutnya diantaranya rekonstruksi 3D. Penelitian ini mencoba mengangkat kembali teknik kalibrasi kamera klasik yang sangat popular, yaitu teknik kalibrasi kamera dengan menggunakan algoritma Tsai. Sebagai simulasi, hasil parameter yang akan didapat akan digunakan untuk melakukan pengukuran tinggi obyek dengan aplikasi dan kemudian dibandingkan dengan tinggi obyek secara real. Dari hasil ujicoba, didapatkan hasil bahwa tahapan proses kalibrasi kamera dengan metode Tsai berhasil dilakukan. Kemudian data parameter yang didapat, dilakukan simulasi dengan ujicoba sebanyak 5 skenario dengan masing-masing skenario dilakukan dengan 2 percobaan. Hasil yang didapat dari hasil pengukuran dengan aplikasi ternyata masih jauh dari hasil pengukuran secara nyata. Galat relative yang didapat dari perhitungan dengan aplikasi rata-rata hanya 50.6% dari perhitungan secara nyata. Hasil ini disebabkan karena proses pengambilan data awal dengan spesifikasi yang terbatas.Kata kunci : kalibrasi kamera, algoritma tsai, computer vision",Teknik Informatika
33,080411100014,PENERAPAN METODE ANALYTICAL HIERARCHY PROCESS DAN FUZZY MULTI-OBJECTIVE PROGRAMMINGUNTUK PEMILIHAN SUPPLIER,"Pemilihan  supplier merupakan salah satu isu penting, karena  pemilihan supplier menjadi bagian dari sebuah  supply chain maka hubungan tersebut akan memiliki pengaruh yang sangat besar terhadap kelangsungan produksi.Pada tugas akhir ini dianalisa mengenai  Analytic Hierarchy Process (AHP) dan Fuzzy Multi-Objective Programming (FMOP) untuk pemilihan supplier di Industri Batik Podhek Pemekasan. Perhitungan AHP akan diperoleh nilai bobot tiap kriteria pemilihan supplier yang nantinya akan jadi nilai masukan pada FMOP. FMOP memberikan solusi memaksimalkan dan meminimalkan tujuan.Setelah dilakukan proses perhitungan faktor kriteria yang paling memberikan kontribusi terhadap pemilihan supplier adalah kriteria harga (0.52), kualitas (0.2) dan tingkat cacat (0.2), dan keterlambatan pengiriman (0.08). Dari hasil penelitian diperoleh bahwa supplier paling optimum adalah  Toko Utara. Untuk bahan baku kain dengan batasan pembelian 0 - 500 lembar didapatkan hasil z1 = 380, z2 = 415, z3 = 85, z4 = 250. Untuk bahan baku pewarna dan malan dengan batasan pembelian 0 - 250 kg didapatkan hasil z1 = 0, z2 = 220, z3 = 30, z4 = 125, dan z1 = 147.5, z2 = 225, z3 = 25, z4 = 125.Kata kunci  :Supply Chain Management (SCM), pemilihan supplier, Analytical Hierarchy Process, Fuzzy, Multi-Objective Programming.",Teknik Informatika
34,080411100041,Model Penjualan Produk Unggulan Batik Khas Pamekasan Berbasis Electronic Commerce,"Kabupaten Pamekasan merupakan salah satu pusat industri dan perdagangan batik tulis yang dapat diandalkan sebagai salah satu sumber pendapatan daerah. Batik tulis Madura, khususnya batik tulis Pamekasan memiliki corak dan design yang khas. Penulis meneliti tentang pembuatan Model Penjualan Produk Unggulan Batik khas Pamekasan berbasis Electronic Commerce. Tujuan penelitian ini adalah Membangun model e-commerce yang interaktif untuk mendukung potensi perindustrian dan perdagangan kabupaten Pamekasan serta mempermudah transaksi penjualan produk unggulan batik tulis khas Pamekasan. Model e-commerce yang diterapkan adalah business to customer (B2C). Metodologi dalam mengerjakan penelitian ini adalah metode SDLC (Software Development Life Cycle), dengan menggunakan SDLC waterfall. Berdasarkan hasil analisis kuisioner yang dibagikan kepada pelanggan dan umum yaitu sebanyak 50 responden, yang mencakup beberapa pertanyaan mengenai fitur-fitur pada website. Simpulan yang dapat diambil yaitu pemodelan yang dibuat cukup baik untuk diimplementasikan menjadi website e-commerce. Hal ini dibuktikan dari hasil kuisoner menunjukkan rata-rata persentase responden yang menjawab setuju mencapai 53%. Kata kunci : Batik, E-Commerce, B2C, Model",Teknik Informatika
