,NPM,Judul,Abstrak,jurusan
67,070411100069,RANCANG BANGUN SISTEM PERAMALAN DISTRIBUSI BERAS MENGGUNAKAN METODE EXPONENTIAL SMOOTHING,"Salah satu komponen penting yang menunjang operasi perusahaan beras adalah kegiatan memprediksi jumlah beras yang dibutuhkan konsumen. Dengan prediksi yang baik dapat dibuat rencana kerja perusahaan lebih efektif dan efisien.  Proses pendistribusian juga harus tepat agar tidak terjadi penumpukan beras di gudang yang megakibatkan kwalitas beras menurun.  Selain itu  pemasukan beras  dan distribusi beras juga harus seimbang supaya terjadi keseimbangn dalam proses distribusi beras. Penelitian ini  mengidentifikasi pola distribusi beras  di BULOG kabupaten Pamekasan. agar  mendapatkan metode peramalan yang terbaik berdasarkan pola data pendistribusian beras. Selain itu sistem yang di buat juga mampu mendapatkan hasil peramalan  periode selanjutnya  sehingga dapat menjadi acuan dalam perencanaan strategi pendistribusian yang  diterapkan di Bulog  Kabupaten  Pamekasan.  Dalam proses pendistribusian  beras  Penentuan metode  exponential smooting  sebagai peramalan yang terbaik  dengan menggunakan data sebelumnya sebagai parameter masukan  dilakukan dengan  cara mengukur tingkat kesalahan  peramalan  dari penerapan  metode tersebut  dan di ketahui peramalan terbaik berada di  alpha  0.1 dengan mengidentifikasi nilai Square Error  (SE) dan Percentage Error  (PE). Dapat diketahui melalui pencarian nilai rata-rata kesalahan sebesar 3.8%, yaitu menghitung Mean Square Error (MSE) dan Mean Absolute Percentage Error (MAPE).   Kata kunci:  Peramalan Pendistribusian, Exponential Smoothing, Mean Error (MSE) Mean Absolute Percentage Error (MAPE) ",Teknik Informatika
68,070411100019,SISTEM PERAMALAN TINGKAT PENGANGGURAN WILAYAH BANGKALAN MENGGUNAKAN ALGORITMA BACKPROPAGATION,"Kabupaten Bangkalan Mempunyai jumlah penduduk tahun 2010 sebanyak 906.761 yang diikuti dengan jumlah pengangguran yang cukup tinggi, tentunya pengangguran menjadi masalah sosial yang harus diperhatikan.  Berdasarkan permasalahan tersebut maka perlu adanya sistem peramalan sehingga bisa menekan angka pengangguran di Kabupaten Bangkalan. Sistem ini dibuat menggunakan Algoritma Backpropagation yang mampu melakukan penyesuaian bobot penghubung sehingga dapat dijadikan solusi untuk menentukan jumlah pengangguran. Jaringan-jaringan dilatih dengan menggunakan beberapa variabel masukan yaitu : data tahun 2006-2010. Setelah Sistem peramalan dengan menggunakan Algoritma Backpropagation ini melalui proses uji coba didapatkan nilai konfigurasi parameter terbaik ialah konfigurasi lerning rate sebesar 0.7 toleransi error 0.1, maksimal epoch 50 dan hidden layer 14.  Parameter tersebut dipilih menjadi parameter terbaik karena menghasilkan jumlah iterasi yang memiliki nilai akurasi error terbaik saat sistem melakukan pengujian yaitu didapatkan MSE sebesar 37206,6 dan MAPE sebesar 1,34% yang mana diperoleh jumlah pengangguran di Kabupaten Bangkalan pada tahun 2010 adalah 24.637 jiwa. Sedangkan pendataan jumlah pengangguan tahun 2010 yang dilakukan oleh BPS Kabupaten Bangakalan adalah 25008 jiwa.	Kata Kunci: Peramalan, Algoritma Backpropagation, Pengangguran.",Teknik Informatika
69,040411100509,PENDETEKSIAN MINUTIAE PADA SIDIK JARI MENGGUNAKAN CROSSING NUMBER,"PENDETEKSIAN MINUTIAE PADA SIDIK JARIMENGGUNAKAN CROSSING NUMBERABSTRAKBerbagai penelitian tentang citra sidik jari, telah banyak dilakukan. Mulai dari pendeteksian, pengklasifikasian sampai dengan pengenalan pola sidik jari. Hal ini dikarenakan keunikan yang dimiliki oleh sidik jari yang dapat dijadikan sebagai pengenalan identitas seseorang.Salah satu fitur dalam pengenalan sidik jari adalah kesamaan letak minutiae pada sidik jari seseorang. Minutiae didefinisikan sebagai titik-titik akhir dan titik-titik awal percabangan dari garis-garis alur (ridge) yang memberikan informasi yang unik dari suatu sidik jari [7]. Secara umum minutiae terbagi menjadi dua macam yaitu minutiae termination yang merupakan tempat ridge berakhir dan minutiae bifurcation yang merupakan tempat ridge memisah atau bercabang.Pada penelitian ini membahas tentang bagaimana mendeteksi letak minutiae pada sidik jari dengan menggunakan metode Crossing Number dengan menggunakan dua skenario pada proses binaryzation. Skenario pertama menggunakan nilai treshold = nilai mean piksel citra, dan skenario kedua menggunakan nilai treshold = 80. Langkah pertama dalam penelitian ini yaitu dengan memasukkan citra sidik jari (load image). Selanjutnya dilakukan grayscaling, binaryzation, thinning, dan block filter. Langkah terakhir, deteksi minutiae melalui ekstraksi minutiae dengan menggunakan crossing number. Dari hasil uji coba diperoleh Pendeteksian minutiae termination menggunakan skenario kedua lebih baik dibandingkan dengan skenario pertama dengan rata-rata akurasi 96,22%. Sedangkan untuk pendeteksian minutiae bifurcation, skenario pertama lebih baik dibandingkan dengan skenario kedua dengan rata-rata akurasi 46,28%. Kata kunci : minutea, minutiae bifurcation, minutiae termination, crossing number.",Teknik Informatika
70,080411100013,EKSTRAKSI PENAMBAHAN STOPLIST DARI KATA UMUM DOKUMEN HASIL KLASIFIKASI PRETOPOLOGY,"Dokumen teks bahasa Indonesia sangat melimpah dan setiap waktu bertambah. Dalam proses pencarian, banyak dokumen yang dihasilkan menjadi kurang relevan jika tidak sesuai dengan keinginan pengguna. Stopword merupakan kata yang “tidak relevan”, namun sering muncul dalam dokumen. Kumpulan stopword disebut stoplist. Pada sistem temu balik informasi, asumsi yang ada adalah dengan menghapus stoplist, maka mengurangi jumlah kata yang akan diproses. Sedangkan kata umum juga sering digunakan pada bidang tertentu. Sehingga perlu dilakukan ekstraksi kata umum dari dokumen hasil klasifikasi dan melakukan perbandingan efektifitas antara aplikasi pencarian-1 menggunakan penghapusan stoplist dengan aplikasi pencarian-2 menggunakan penghapusan stoplist dan kata umum untuk meningkatkan relevansi dan waktu proses pencarian dokumen. Hasil uji coba klasifikasi pretopology dengan 25 dokumen teknik, 25 ekonomi dan 25 pertanian diperoleh nilai rata-rata recall dan precision sebesar 90% dan 76%. Uji coba pencarian dengan 6 query terhadap 285 dokumen teknik, 193 ekonomi dan 268 pertanian pada aplikasi pencarian-1 diperoleh nilai rata-rata recall, precision, f-measure dan waktu proses adalah 96.7%, 22.5%, 30.6% dan 0.239 detik. Sedangkan aplikasi pencarian-2 dengan threshold kata umum 1% adalah 96%, 67%, 76.5% dan 0.098 detik. Sehingga dapat dikatakan bahwa aplikasi pencarian-2 lebih efektif dari pada aplikasi pencarian-1.Kata kunci: Sistem temu balik informasi, Stoplist, Klasifikasi Pretopology, Kata Umum.",Teknik Informatika
71,060411100844,Rancang Bangun sosial media sebagai software as a service untuk media pembelajaran dan test TOEFL,,Teknik Informatika
72,070411100137,Analisa Pemilihan Alat Kontrasepsi Dengan Menggunakan Metode Naive Bayes,"KB adalah singkatan dari Keluarga Berencana. Menurut Kamus besar Bahasa Indonesia (1997), KB adalah “Gerakan untuk membentuk keluarga yan sehat dan sejahtera dengan mengatur kehamilan”. Dengan kata lain KB adalah perencanaan jumlah keluarga. Pengaturan bisa dilakukan dengan penggunaan alat-alat kontrasepsi atau penanggulangan kehamilan seperti pil, suntik, IUD, dan sebagainya. Jumlah anak di anggap ideal adalah dua anak.Dalam proses penentuan pemilihan alat kontrasepsi tersebut memerlukan  Metode peramalan yang digunakan dalam sistem ini adalah metode Naïve bayes classifer untuk menghitung jumlah ketepatan dalam menentukan pilihan alat kontrasepsi. Aplikasi sistem pendukung keputusan dengan Naïve bayes classifer dapat dijadikan solusi untuk menentukan alat kontrasepsi, Nilai konfigurasi parameter untuk sistem pendukung keputusan dengan menggunakan Naïve bayes classifer.Kata Kunci : Alat Kontrasepsi, Sistem Pendukung Keputusan,  Naïve bayes classifer",Teknik Informatika
73,090411100061,EKSTRAKSI FITUR PRINCIPAL COMPONENT ANALYSIS (PCA) UNTUK PENGENALAN HURUF ABJAD BAHASA ISYARAT PADA SISTEM ISYARAT BAHASA INDONESIA (SIBI),"Komunikasi merupakan hal yang sangat penting dalam kehidupan bermasyarakat, dan semua orang pasti membutuhkan komunikasi sebagai sarana bersosialisasi dengan orang lainnya, tak terkecuali mereka yang memiliki keterbatasan fisik, tuna rungu dan tuna wicara misalnya. SIBI menupakan suatu bahasa yang menggunakan gerakan tangan dan ekspresi wajah, yang merupakan suatu alat komunikasi bagi penderita tuna rungu dan tuna wicara.Dengan latar belakang tersebutlah penelitian ini dilakukan. Penelitian ini bertujuan untuk dapat membuat sistem pengenalan abjad jari pada SIBI, mulai dari abjad “A” hingga “Z”. Metode yang digunakan dalam penelitian ini adalah metode ekstraksi fitur Principal Component Analysis dan pengukuran jarak kedekatan menggunakan Euclidean Distance. Penelitian ini menggunakan 1092 data citra yang akan digunakan sebagai data training dan testing untuk proses uji coba pada sistem yang telah dibuat. Dengan menggunakan metode ekstraksi fitur PCA dan penghitungan jarak dengan Euclidean Distance, dari tiga skenario pengujian yang telah dilakukan pada penelitian ini, menghasilkan tingkat akurasi sebesar 77.11% untuk uji coba dengan memisahkan data training menjadi dua, yaitu data training untuk semua huruf kecuali “J” dan “Z” dan data training huruf “J” dan “Z” saja.",Teknik Informatika
74,080411100046,Manajemen Workflow Layanan Akademik Berbasis Business Process Management System (BPMS),"Layanan akademik merupakan usaha yang dilakukan oleh perguruan tinggi untuk memberikan kemudahan pada pemenuhan kebutuhan mahasiswa dalam hal yang berkaitan dengan kegiatan akademik. Untuk mendapatkan suatu layanan akademik yang efektif dan efisien diperlukan pemodelan dengan menggunakan BPMS. BPMS menyediakan visualisasi model proses bisnis dengan berbagai fasilitas pendukung runtime service, yang mampu menjembatani antara kebutuhan strategi bisnis dan teknologi informasi. Melalui penggunaan BPMS yang didukung pemodelan yang praktis mampu mengoptimalkan efisiensi penggunaan waktu, tenaga dan biaya baik selama proses pembangunan maupun implementasinya. Dari model dan desain yang digunakan pada penelitian ini didapatkan implementasi sistem yang handal untuk transaksi real time yang memenuhi kebutuhan proses bisnis yang kompleks, yaitu pada layanan akademik perguruan tinggi.",Teknik Informatika
75,060411100831,APLIKASI SISTEM PENDUKUNG KEPUTUSAN DALAM PENENTUAN BEASISWA BIDIK MISI DENGAN PERBANDINGAN METODE ANALITYCAL HIERARCY PROCESS (AHP) DAN ELIMINATION AND CHOICE TRANSLATION REALETY (ELECTRE)	(Studi K,"Pemerataan dalam akses ke perguruan tinggi jenjang pendidikan menengah, sampai saat ini masih merupakan masalah di negara ini. Banyak lulusan jenjang pendidikan menengah yang berprestasi dan merupakan calon mahasiswa potensial tidak dapat melanjutkan ke jenjang pendidikan tinggi karena berasal dari kalangan keluarga yang kurang mampu secara ekonomi, menghadapi kendala seperti inilah program terbaru yang dikelola DIKTI adalah berupa solusi beasiswa bidik misi. Dengan perbandingan antara Metode Analitycal Hierarcy Process (AHP), untuk menyusun suatu struktur hierarchy, menentukan nilai prioritas kriteria dan Elimination and Choice Translation Realety (Electre) digunakan pada kondisi dimana alternatif yang kurang sesuai dengan kriteria dieleminasi, dan alternatif yang sesuai dapat dihasilkan. Berdasarkan uji coba dengan menggunakan data bidik misi tahun 2011, telah dapat dibuat suatu sistem pengambilan keputusan dalam prosentase ketepatan antara sistem dengan kondisi real, untuk metode  AHP 83.1 % dan metode Electre 49.01 %.Keyword : AHP, Electre, Bidik Misi, Consistency,  Kriteria dan Nilai Prioritas.",Teknik Informatika
76,060411100774,DESAIN DAN IMPLEMENTASI INFRASTUKTURE AS A SEVICE CLOUD COMPUTING MENGGUNAKAN PROXMOX,"Kebutuhan akan sumber daya teknologi di bidang software dan hardware semakin besar, sedangkan investasi akan sumber daya tersebut membutuhkan waktu, biaya, dan tenaga yang tidak mungkin didapat dalam waktu yang singkat. Solusinya adalah dengan menggunakan teknologi cloud computing Infrastructure as a Service. IaaS cloud computing adalah teknologi yang memberikan sumberdaya teknologi informasi dasar, yang meliputi media penyimpanan, processing power, memory, sistem operasi, dan kapasitas jaringan yang dapat digunakan oleh pengguna  cloud client. Dengan teknologi ini pengguna dapat memenuhi semua kebutuhan sumber daya komputasi tanpa mengorbankan waktu, biaya dan tenaga, dikarenakan pengguna hanya meminta layanan yang dibutuhkan kepada penyedia cloud. Pada penelitian ini, diimplementasikan  cloud computing  dengan menggunakan  proxmox yang merupakan  operating sistem  open source dengan kemampuan Infrastructure as a Service  (IaaS). Infrastructure as a Service dalam proxmox menggunakan teknologi virtual server sehingga utilitas dari hardware server menjadi maksimal. Server proxmox saat menjalankan virtual machine secara bersama dengan sistem operasi windows xp, mampu menjalankan 17 virtual machine sekaligus, sedangkan saat menjalankan sistem operasi ubuntu 9.10 mampu menjalankan 18 virtual machine sekaligus. Dan saat menjalankan ftp server server proxmox mampu menjalankan 10 virtual machine sekaligus.",Teknik Informatika
77,060411100830,Sistem Informasi Manajemen Beasiswa Fakultas Teknik Universitas Trunojoyo dengan menggunakan Metode F--AHP,"Sesuai dengan peraturan yang telah ditentukan oleh pihak pemberi beasiswa terhadap penerima beasiswa, maka diperlukan kriteria-kriteria untuk menentukan siapa yang akan terpilih untuk menerima beasiswa. Pembagian beasiswa dilakukan oleh beberapa lembaga untuk membantu seseorang yang kurang mampu ataupun berprestasi selama menempuh studi. Untuk membantu penentuan dalam menetapkan seseorang yang layak menerima beasiswa maka dibutuhkan Multiple Criteria Decision Making (MCDM) untuk mempertimbangkan nilai terbesar dalam memperoleh factor kompleks yang berdasarkan pada asumsi sifat subyektifnya lebih banyak. Fuzzy Analytic Hierarchy Process (FAHP) merupakan penggabungan metode Analitic Hierarchy Proses dengan pendekatan Fuzzy yang relatif terbaru yang cocok dengan permasalahan yang berhubungan dengan sistem saling ketergantungan, dan ini sangat efisien dan relevan jika sistem di gunakan serta di berlakukan di fakultas teknik universitas trunojoyo dengan beberapa faktor kriteria dan subkriteria serta skala perbandingan berpasangan yang di ajukan oleh stakeholder, untuk menganalisa validitas penerima beasiswa. Berdasarkan hasil uji coba sistem, terdapat perbedaan selisih hasil rekomendasi dari sistem, terhadap data aktual, dan dari beberapa beasiswa yang ada, beasiswa magang  yang dapat di analisa dengan perolehan 70,58 %.Kata kunci : FAHP, Pengambilan keputusan multi kriteria, seleksi beasiswa.",Teknik Informatika
78,070411100006,PENERAPAN ALGORITMA GREEDY PADA STRATEGI SERANG UNIT PLAYER DALAM GAME TOWER DEFENSE,,Teknik Informatika
79,080411100031,RANCANG BANGUN APLIKASI MEDIA PEMBELAJARAN HURUF ALFABET UNTUK PERANGKAT MOBILE ANDROID,"Media pembelajaran merupakan salah satu solusi untuk mempermudah penyampaian pesan yang dimaksud dalam sebuah materi pembelajaran karena akan mempercepat anak didik untuk memahami pelajaran atau materi yang dimaksud. Penggunaan perangkat mobile berbasis sistem operasi Android sebagai media pembelajaran sudah banyak dikembangkan karena aplikasinya memiliki tampilan yang user friendly dengan interaksi layar sentuh yang  menarik untuk selalu digunakan terutama oleh anak-anak.Dalam media pembelajaran yang dikembangkan, terdapat pengenalan pola dari karakter alfabet yang berfungsi untuk menguji pemahaman karakter dari pengguna setelah mempelajari bentuknya lewat tutorial. Pengujian dilakukan secara langsung dengan menuliskan bentuk dari huruf kapital. Dengan menggunakan mesin pengenalan pola yang telah dikembangkan oleh Tesseract, mesin open source yang umum digunakan sebagai Optical Character Recognition (OCR) akan dilakukan koreksi dari huruf kapital yang ditulis.Aplikasi media pembelajaran berfungsi dengan baik pada perangkat dengan berfungsinya semua tombol dan atribut aplikasi. Mesin Tesseract yang digunakan memiliki tingkat akurasi pengenalan 100% pada huruf kapital dengan jenis Arial, Calibri dan Times New Roman. Selain itu aplikasi tersebut juga memiliki respon postif dari anak-anak yang telah menggunakannya. 100% dari sampel uji coba menyatakan bahwa aplikasi tersebut menarik dan membantu dalam mengenal huruf alfabet.",Teknik Informatika
80,060411100741,Pencarian String Menggunakan Algoritma Boyer Moore Pada Dokumen,"Proses pencarian merupakan salah satu kegiatan penting dalam pemrosesan data. Proses pencarian dapat menghabiskan waktu jika ruang pencariannya besar, karena",Teknik Informatika
81,090411100131,RANCANG BANGUN APLIKASI SISTEM PELAPORAN DAN INFORMASI KONDISI JALAN BERBASIS MOBILE ANDROID,"Jalan raya merupakan prasarana transportasi yang sangat vital di setiap daerah. Baik wilayah perkotaan maupun pedesaan, jalan raya menjadi prasarana penunjang yang utama bagi keberlangsungan aktivitas masyarakat. Sebagai usaha untuk tetap menjaga stabilitas prasarana masyarakat ini diperlukan proses pengelolaan data kondisi jalan yang baik. Namun, saat ini proses pencatatan dan pemetaan kondisi jalan masih dilakukan secara manual. Proses tersebut menyebabkan hasil survey memiliki keakuratan data maupun hasil pemetaan yang kurang baik. Demi melakukan perbaikan terkait proses pengelolaan data kondisi jalan telah dikembangkan sebuah aplikasi yang mampu membantu dalam proses pengelolaan data kondisi jalan. Aplikasi ini memiliki dua fungsi utama yaitu untuk membantu dalam melakukan proses survey kondisi jalan dan pemetaan kondisi jalan. Proses pencatatan dilakukan dengan menandai titik awal dan akhir ruas jalan kemudian menentukan kondisi ruas jalan tersebut. Dalam melakukan proses pemetaan kondisi jalan, aplikasi ini dilengkapi dengan peta Google sebagai peta dasar, sehingga dapat memberikan hasil pemetaan kondisi jalan dengan tingkat akurasi yang baik. Dengan menggunakan aplikasi Android dan Google Maps pemetaan kondisi jalan di Kabupaten Bangkalan dapat diimplementasikan dengan baik dengan tingkat akurasi posisi dalam peta Google yang bervariasi dengan nilai akurasi terburuk 11 meter dan akurasi terbaik 1 meter.",Teknik Informatika
82,090411100007,Aplikasi Personalisasi Hints Soal Ujian dengan Menggunakan Frequents Pattern Growth,"Perkembangan e-learning pada saat ini sudah terbilang pesat, hampir semua pihak telah mengerti e-learning. SMPN 2 Larangan adalah contoh sekolah yang sempat menggunakan elearning dalam suatu mata pelajaran. Namun, pengajar hanya memanfaatkan untuk mengambil nilai dari ujian yang diberikan. Oleh karenanya, dalam penelitian ini akan menggunakan data-data yang dianggap tidak penting untuk membantu para pengajar dalam mengukur perkembangan dan membantu siswa dalam mengerjakan soal yang dianggap sulit. Mata pelajaran yang digunakan dalam e-learning ini adalah matematika. Matematika merupakan salah satu mata pelajaran yang dianggap sulit oleh sebagian siswa, karenanya dengan aplikasi ini akan sedikit membantu siswa dalam mengerjakan soal. Algoritma yang digunakan dalam aplikasi ini adalah frequent pattern growth, yaitu algoritma dalam association rules untuk mencari hubungan kombinasi dari setiap data.  Data yang digunakan adalah jawaban salah dari 120 siswa. Soal terdiri dari 200 nomor dari 20 materi yang ada. Dalam penelitian ini, data dipecah menjadi 5, yaitu data dari 5 murid, 25, 50, 75, 100 dan 120 murid. Hasil penelitian dari pembagian data tersebut, diketahui bahwa semakin banyak data, maka kombinasi itemset yang terbentuk juga akan semakin banyak, dan waktu proses juga akan semakin lama. Namun, semakin besar minimum support yang diinputkan, maka kombinasi yang terbentuk akan semakin sedikit. ",Teknik Informatika
83,080411100096,ANALISA KESESUAIAN PENEMPATAN PEGAWAI NEGERI SIPIL TENAGA PENDIDIKAN BERBASIS GIS MENGGUNAKAN METODE NAÏVE BAYESIAN,"Kesesuaian penempatan merupakan hal yang sangat penting dalam penyediaan tenaga pendidik suatu instansi sekolah. Penempatan tenaga pendidik yang tepat pada jabatan/posisi yang tepat akan membentuk kepuasan secara psikologis kepada tenaga pendidik, akhirnya akan melahirkan motivasi dan kreatifitas kerja yang tinggi. Penelitian ini membahas tentang sistem yang dapat menganalisa kesesuaian penempatan Pegawai Negeri Sipil(PNS) Tenaga Pendidik berbasis Geographic Information System (GIS), sehingga penempatan PNS tenaga pendidik dapat dianalisa kesesuaian penempatannya serta dipetakan menurut instansi sekolah masing-masing guna mengetahui jarak antara instansi dengan alamat rumah PNS. Sistem ini dibangun menggunakan google map untuk pemetaanya dan metode Naïve Bayes untuk menganalisa kesesuaian penempatan PNS tenaga pendidik, yang memprediksi probabilitas di masa depan berdasarkan pengalaman dimasa sebelumnya. Atribut yang digunakan adalah Jenis Kelamin, Golongan, Tingkat Pendidikan, Jarak Rumah. Output dari sistem ini berupa analisa kesesuaian penempatan PNS. Untuk menghitung keakurasian menggunakan 150 data dengan ujicoba sebanyak 3 kali. Dari ujicoba tersebut menghasilkan akurasi tertinggi 93% dengan data training sebnyak 120 dan data ujicoba 40. Hasil dari penelitian ini adalah metode Naïve Bayes dapat diaplikasikan untuk menentukan status kesesuaian penempatan PNS tenaga pendidik. Dengan dibuatnya aplikasi analisa ini data pegawai negeri sipil tenaga pendidik dapat dipetakan menurut instansi sekolah masing-masing untuk kemudian dapat di analisa efektifitas penempatannya dengan metode Naïve Bayes.",Teknik Informatika
84,090411100134,Analisa Klasifikasi Vendor Project Procurement Management Menggunakan Naive Bayes Classifier,"PPM (Project Procurement Management) sangat diperlukan dalam meningkatkan daya saing perusahaan.Performance vendor dalam PPM dibutuhkan untuk dapat mengukur kinerja vendor yang terlibat dalam PPMatau menejemen pengadaan proyek. Berjalan atau tidaknya sebuah proyek dapat dilihat dari menejemenpengadaan atau tim procurement dalam memenuhi kebutuhan proyek yang direncanakan. Pada penelitian kaliini akan diusulkan penggunaan metode naïve bayes classifier untuk mengklasifikasikan performance vendordalam PPM berbasis PMBOK (Project Management Body Of Knowledge). NBC (Naïve bayesian classifier)adalah salah satu metode sederhana yang dapat membentuk suatu pengklasifikasian standar denganmenggunakan teori probabilitas sebagai dasar teori. Terdapat beberapa kriteria yang digunakan berdasarkanPMdoc (Project Management doc). Dari sistem ini akan dapat mengetahui kinerja vendor dalam 3 kategoriyaitu memuaskan, cukup memuaskan, tidak memuaskan.",Teknik Informatika
85,060411100854,APLIKASI XNA GAME STUDIO 3.0 DALAM GAME ROLE PLAYING GAME (RPG) DUA DIMENSI MENGGUNAKAN METODE TURN BASED SYSTEM,,Teknik Informatika
86,090411100063,ANALISA FAKTOR PADA FELDER-SILVERMAN LEARNING STYLE DIMENSIONS (FSLSM) MENGGUNAKAN METODE PCA ,"Dalam dunia pendidikan dan pengajaran di kelas maupun melalui e-learning, hal utama yang menjadi fokus adalah peserta didik. Bila dikaji dengan cermat, setiap individu mempunyai kemahiran yang berbeda ketika memproses suatu maksud dari sebuah pembelajaran. Oleh sebab itu, perlu dikembangkan konsep adaptivitas gaya pembelajaran yang sesuai. Karena, hal tersebut merupakan faktor penting terhadap prestasi belajar para peserta didik. Dalam tugas akhir ini, membahas tentang analisa gaya belajar siswa Felder-Silverman Learning Style Model (FSLSM) melalui pengambilan data kuisioner ILS. FSLSM merupakan salah satu model gaya belajar yang mengelompokkan menjadi empat dimensi yaitu active atau reflective, sensing atau intuitive, visual atau verbal, dan sequential atau global. ILS merepresentasikan ciri dari dimensi gaya belajar dalam 44 item soal kuisioner. Banyaknya pertanyaan yang mewakili tiap-tiap dimensi sebagai variabel komponen untuk proses pendeteksian, menyebabkan tingkat akurasi dan kecepatan deteksi karakteristik menjadi rendah. Sehingga diperlukan adanya reduksi ciri terhadap pertanyaan-pertanyaan tersebut berdasarkan analisa faktor utama melalui penerapan metode Principal Component Analysis (PCA). Sistem yang telah dibangun dengan penerapan metode PCA mampu mereduksi soal-soal kuisioner dari 44 soal menjadi 16 soal dengan akurasi keberhasilan tertinggi sebesar 71.7%. Pengujian dilakukan pada 400 data kuisioner sebagai data testing sekaligus data training.",Teknik Informatika
